id,tweet
[1327749549637582849],negara lain sibuk bikin vaksin biar bs jualan. disini sibuk bagi2 masker dong. https://t.co/vrnovfomsl
[1327745888425439233],"vaksin corona jadi kunci ri keluar dari jurang resesi
https://t.co/vmih8wygbo"
[1327667368219136000],asita ntb: kehadiran vaksin covid-19 bisa hidupkan kembali ekosistem pariwisata https://t.co/j3rlhzyojg
[1327646742267846658],"vaksin belum ada, alasan kenapa bnpb bagikan ribuan masker di acara habib rizieq https://t.co/i4drjbyokn"
[1327644831649198080],kdnk tahun depan bergantung kepada vaksin covid-19 https://t.co/srjg18e4c8 https://t.co/9tknrxznyh
[1327642872871407617],covid-19: indonesia mulakan kempen vaksinasi besar-besaran bulan depan - jokowi https://t.co/gdlsx7dh7q
