id,tweet
[1319788200865361921],"kabar mulai ada pendataan vaksin covid-19, ternyata... https://t.co/6ngenntvkh"
[1319788197640011779],relawan vaksin covid-19 produksi astrazeneca dan oxford tewas di brasil #tempodunia https://t.co/ouwurery41
[1319787924204912640],"janji semu pemerintah!!!
batal! tak ada vaksinasi covid-19 pada november 2020, airlangga hartarto: 'ini hanya persi… https://t.co/stvi4eeaux"
[1319787858937352193],@airlangga_hrt harus di tekankan lagi pak ke masyarakat bahwa vaksin bukan pengganti masyarakat. karena sudah banya… https://t.co/bdxgyiz6kh
[1319780889459486720],kabar baik! uji coba vaksin covid astrazeneca &amp; j&amp;j berlanjut https://t.co/vjy54javeg
[1319780633401454593],"vaksin bukan solusi jangka pendek untuk atasi pandemi covid-19. perlu cakupan vaksin yg tinggi, sangat tergantung e… https://t.co/lhhwhiej2m"
[1319780466585595904],"pil-kada terbukti pil paling manjur meredam covid-19.
ga perlu vaksin wesss..😁

#anehtapinyata"
[1319780355746926593],"kabar baik corona: kasus aktif turun 6,79% hingga tes covid-19 capai 82,5% #bersamalawancorona #vaksincorona… https://t.co/3driyr1t0r"
[1319779375974285313],"@ndoro_raghil kl udh ada vaksin yg benar2 teruji, menurt sy jauh lebih baik divaksin ketimbang tdk divaksin.. 
pred… https://t.co/7ts1kdca6s"
[1319773751001530368],"@fahiraidris @sindonews gak usah pake vaksin,corona nya aja gak jelas ada apa ngga nya.....jangan membodohi kami de… https://t.co/liubyoo1te"
[1319773609238278147],"luhut ungkap vaksin covid-19 november terancam molor, ini penyebabnya https://t.co/m4q6h9azse #nasional"
[1319773583946567681],@ditamanurung lho iya ta? wkwkwk iklan vaksin covid ya?
[1319773115262459904],cek-cek opini soal vaksin covid-19
[1319772654107123712],apakah penyuntikan vaksin covid tdk menunggu hasil studi tahap 3 dipublikasikan? utk melihat efektivitas vaksin https://t.co/bvtvtf8fzw
[1319772520690503681],"bebas ! segera gantikan yg sekarang, agar pandemi bisa berhenti tanpa vaksin seperti pada masa flu burung🤟 https://t.co/uwlmk3hfaz"
[1319771387423125504],"@fadlizon gak usa pikir vaksinx dr mana, msykt tunggu tindakan cepat agar bebas dr covid-19."
[1319771265113227266],"@republikaonline 8 sukarelawan suntik vaksin covid dilaporkan meninggal, belum ada laporan vaksin ampuh. enak aja s… https://t.co/ab6dz6038b"
[1319762609013313536],"apa banget pemerintah, ngurus corona ogah2an tapi giliran ada vaksin yang belom teruji di itb dan ipb malah maksa n… https://t.co/hdoqd1o8n2"
[1319762605188075520],"vaksin covid-19 diprioritaskan untuk warga usia 18-59 tahun
https://t.co/y187i3rxif https://t.co/yedwzhklr3"
[1319762103461269504],"298.103 vaksin covid-19 akan disiapkan untuk warga depok
https://t.co/wo9ur0qje6 https://t.co/dvpxaofnhp"
[1319761682671955969],"luhut sebut rencana vaksinasi covid-19 november bisa molor - https://t.co/kbwkwgzcav

#indonesia"
[1319742960150310912],"pmi siap vaksinasi covid-19 - https://t.co/qyc8f490z3

#indonesia"
[1319741993895952384],"top 3 tekno berita kemarin: relawan vaksin covid-19, limbah di batan indah https://t.co/lgyrbb0ntj"
[1319741120503369728],"sadarlah, bukan hanya vaksin covid saja yg tdk jelas, vaksin2 yg lain juga tdk jelas asal usul dan penelitiannya, d… https://t.co/vmgfvmaezy"
[1319708802153877505],"wacana pemberian vaksin covid-19 oleh pemerintah pusat terus bergulir. namun, tampaknya tak semua orang akan mendap… https://t.co/oyvplefskw"
[1319707647562575873],bulan depan vaksin udah ada yg diutamakan dulu adalah team medis selanjutnya baru utk umur 18-40 th keatas karena m… https://t.co/eixinslq9q
[1319701618191814656],"@savemoslem1 vaksin covid-19 tak ada,yg ada covid-19.jadi covid-19 &amp; vaksin itu berbeda jalan tetapi satu tujuan un… https://t.co/jixwj32jre"
[1319700204900134912],"jangan bohongi rakyatmu dg nama vaksin covid-19. vaksin covid-19 tak ada. yg ada program konspirasi who,ifo &amp; codex… https://t.co/v6a8gzt7ra"
[1319699237807030272],"mulai oktober, dilakukan vaksinasi flu di belahan bumi utara. karena pandemi c19, peminat vaksinasi tahun ini menin… https://t.co/qmx22eebbl"
[1319693863632523265],"judul beritanya clickbait. berita ini tentang vaksin influenza ya, bukan covid. https://t.co/0h0xwc4gld"
[1319688355710369793],"6. pada tataran nasional, indonesia telah membentuk konsorsium untuk mempercepat penemuan #vaksin #covid-19 yang di… https://t.co/fre2hcvthq"
[1319687812099211272],ilmuwan dunia terus bekerja mengembangkan vaksin yang tepat untuk memerangi virus corona. beberapa kandidat vaksin… https://t.co/hkhu1eef1u
[1319687807674142720],ksad temui dirut bpjs kesehatan minta data prioritas penerima vaksin covid-19 #taucepattanpabatas #beritaterkini… https://t.co/a594efshix
[1319687636018081792],@null ksad temui dirut bpjs kesehatan minta data prioritas penerima vaksin covid-19 an  https://t.co/0jvxp2w2d2
[1319682502454243328],wagub dki minta warga percaya saja soal vaksin covid https://t.co/mfrgdxy6ey
[1319681754328752129],@drpriono1 sy senang twit ini. tapi twit ini bukan berarti skedar arahkan bahwa vaksin harus ikuti gavi sbgaimn yg… https://t.co/ayznjx3bej
[1319681095378423808],@skaspani_ong kontraktor pengadaan vaksin covid-19?
[1319669678571057153],"@metro_tv @mediaindonesia dari mulai penyebaran hingga vaksinnya sudah digiring isu-isu miring, yang berusaha memba… https://t.co/rsvdshtbro"
[1319669426845745155],@dantepamungkas @yunartowijaya vaksin kan hny salah satu strategi. smpai kini sy apresiasi pndapat kolegial kedokte… https://t.co/vassv2eztd
[1319665724122513409],"@tirta_hudhi biar ada vaksin jg tetap hrs masker an, cuci tangan, distancing, makan yg teratur.. krn biar sdh vaksi… https://t.co/szmyly9h1w"
[1319663044788547584],setelah masker dan rapid para komprador akan menyasar bisnis vaksinasi yang keuntungannya berkali - kali lipat dan… https://t.co/etuddqex4j
[1319662903503454213],oya.. belum lagi yg terlibat dalam uji klinis fase 3 vaksin covid-19. partisipan berjumal 1600an orang. misalnya ad… https://t.co/bhprp7imt4
[1319662867113775106],ormas islam dan majelis ulama indonesia (mui) diminta untuk membantu pemerintah dalam melakukan sosialisasi vaksin… https://t.co/bzzgnlwipn
[1319662675261939713],"@pbidi @klikpdpi #vaksincorona
@rumahsakit_ui @klikdoktercom
@bem_si @ridwankamil @aniesbaswedan
@aagym @haedarns… https://t.co/1vorbds82x"
[1319662643980849152],bio farma adalah perusahaan negara yang dipercaya untuk membuat vaksin di dunia sehingga tidak perlu diragukan lagi… https://t.co/8c7hlkrq8q
[1319662386794561537],bio farma adalah perusahaan negara yang dipercaya untuk membuat vaksin di dunia sehingga tidak perlu diragukan lagi… https://t.co/y50xn3mobo
[1319660067000479744],pemerintah rencanakan vaksinasi masal covid 19. tapi ada yg takut krn bikinan cina. kl  saya menyarankan agar yg an… https://t.co/w8qwdpcm3t
[1319659936704458752],cuma yg jadi concern disini adalah perlu berhati2 thdp vaksin covid kelak akan gimana. vaksin flu yg sudah jadi age… https://t.co/4xn2q27hhc
[1319659812121030657],"@taephaniee semoga wabah cepat berlalu, vaksin segera di pasarkan ke masyarakat, semua yg ada di fandom sehat selal… https://t.co/2og4ymqmzu"
[1319657360340643846],"kenapa beda negara beda corona?
seharusnya setiap negara harus buat vaksin sendiri, ibarat bom yg meledak tentu ada… https://t.co/bjhwysinmz"
[1319657105872154625],satgas covid bicara soal mekanisme pemberian vaksin https://t.co/nfwj84qf2h
[1319654456401645568],@ayamdenlapeeeh emang vaksinnya disana udah bisa buat menghalang covid kak?
[1319653805395423237],@fikhamelia gatau dah ngapain buru2 wkwkwk kayaknya buat cuan ngalir aja nutupin kerugian gara2 covid. harga vaksin… https://t.co/okimqx49na
[1319651539699396609],"luhut perkirakan vaksin covid-19 dari china tak jadi datang november 2020, ini alasanya https://t.co/ky7pnlxgtd lewat @wartakepri"
[1319651515615698944],"bodebek sumbang kasus terbesar di jabar, depok jadi wilayah pertama lokasi vaksinasi covid-19

https://t.co/qgobsolqzi"
[1319651456740323328],"@napolleonn_ wkt bayi d vaksin polio,cacar trus apa lg tuh🤔

skrng vaksin covid ,badanku penuh vaksin"
[1319651309650202626],#editorialmediaindonesia hari sabtu (24/10) live pukul 07.05 wib akan membahas soal isu-isu krusial soal vaksin cov… https://t.co/0fs68j86t8
[1319646516840067072],@leclarius ya kan padahal di luar udh pada kena mulai riset vaksin ketika kita di sini masih leyeh2 blg corona gabi… https://t.co/fubr2xwwu8
[1319646270361800705],"pengakuan menko luhut, sempat ditawari suntik vaksin covid-19 oleh menlu china https://t.co/iya8qyrcff https://t.co/dlaalym5gy"
[1319643081516314625],"dpr ketika awal awal kasus covid : ""prioritaskan kami untuk tes pcr/swab""
sekarang pas udah mau ada vaksin kenapa e… https://t.co/1yplapdwee"
[1319638282443972608],"bagaimana keamanan dan efektivitas vaksin covid-19 yang akan digunakan di indonesia?

simak webinar kolaborasi… https://t.co/tnawhmu0ko"
[1319637936594247681],"@thalibhelmy @cnnindonesia wahhhhh maunya ini vaksin corona buatan sono gitu, kl judul lengkap ya g di baca beritanya"
[1319636030627016704],hal itu sama seperti penyakit-penyakit yang dahulu juga pernah menjadi wabah sebelum vaksin dilakukan seperti campa… https://t.co/ws4olhjttb
[1319635320380424193],"pengakuan menko luhut, sempat ditawari suntik vaksin covid-19 oleh menlu china https://t.co/b8lc0xhluw"
[1319633227594698754],"i dont believe in conspiracy, but somehow.. it makes sense in the end.

memperlama pandemi utk urusan bisnis vaksin… https://t.co/kc3gtak3dy"
[1319633143670788096],"haha ujung nya kok begini..
kayaknya udah heboh bilang akan ada vaksin..

https://t.co/ppag57rpv6"
[1319632570053582848],"banten dapat jatah 8,1 juta vaksin covid-19 https://t.co/xstb9p6yd4 https://t.co/ihh9i85rvw"
[1319630665470468096],jumlah total kandidat vaksin yang sangat berpotensi untuk bisa disediakan di indonesia adalah sekitar 300 juta dosi… https://t.co/ljxo4xrjrg
[1319630573497769990],"inggris, italia, jerman warganya mulai pada demo tolak masker, lockdown, dan vaksin. dan disini justru sebaliknya..… https://t.co/sktnlsphoj"
[1319630355637301248],"bio farma adl satu satunya bumn di indonesia yg memproduksi vaksin, serum &amp;produk life science. dgn kapabilitas &amp; p… https://t.co/pslxfvnhtu"
[1319630286267666432],satgas covid-19: skema vaksinasi sudah masuk fase akhir https://t.co/foaoveopgw
[1319630097943416834],"jangan jadikan vaksin perang ideologi 

https://t.co/azu5ch8gyj

@motizenchannel 

#nasional #politik #ideologi #kesehatan #covid_19 #vaksin"
[1319627980235128833],"kalau boleh usul, pemerintah tdk usah tergesa mengadakan vaksin covid-19 dari negara mana pun, trmsk dari rrc,  lbh… https://t.co/3q6do73g7h"
[1319626112004046849],"banten akan dapat 8,1 juta vaksin covid-19 dari pusat https://t.co/poin6tpcth"
[1319624204132601858],"@kkpgoid karena banyaknya masyarakat yg terlanjur gk percaya pada vaksin covid-19, bahkan termasuk sebagian tenaga… https://t.co/aucsxj9ur0"
