id,tweet
[1302685329246138368],kampanye nya dapet vaksin corona gratis brooook https://t.co/xqmu6tmg0r
[1302661752115490816],"kalau covid belum ada vaksinya
kalau kamu gak ada duanya.. 

selamat istirahat kesayangan.."
[1302643806446276608],42 persen peserta alami sakit kepala usai uji coba vaksin covid-19 https://t.co/t3v4ilzz1a
[1302635490131099648],"jgn bahas nikah mulu napa, bahas tu yg lebih berbobot gitu omnibus law kek vaksin covid kek atau saham gitu. nikah… https://t.co/z1zj87l9rp"
[1302630397205913600],pegawai sinovac dan keluarganya jadi sasaran uji coba vaksin covid-19 https://t.co/tgjsjixjhw https://t.co/q0qmlipljt
[1302617822783090690],"belum selesai uji klinis, 90 persen karyawan sinovac diberi vaksin corona https://t.co/cghygmmj9q https://t.co/6bcmqliuvl"
[1302617821399015425],"belum selesai uji klinis, 90 persen karyawan sinovac diberi vaksin corona https://t.co/evcsjlvcnq https://t.co/7gywjhj7qf"
[1302606871681851392],@hasbirofiqi wahahaahha di gorontalo udh ada vaksin corona mas🤣
