id,tweet
[1313616650868977667],@zr9q_ @winarto_sarsidi @ridwankamil tunjukkan saja kang bhw akang pernah jadi relawan vaksin covid-19 sementara pa… https://t.co/tdzrbrcmtz
[1313611566319771649],@vivacoid sepertinya efek vaksin corona😅
[1313605708563111937],bpom amerika pastikan vaksinasi covid baru bisa setelah pilpres https://t.co/37ihazcmtw https://t.co/vxlqwaa4nb
[1313557689822191617],juru bicara satgas penanganan covid-19 wiku adisasmito memastikan vaksin yang akan disuntikkan masyarakat sudah mel… https://t.co/sqhaz38cdn
[1313536717509423104],pemerintah memastikan vaksin covid-19 tersedia hingga 2022 #vaksin #astrazeneca https://t.co/yo2zi9omei https://t.co/sehz8a8ayz
[1313499694782459904],baru kemarin lusa beredar isu kalo jangan2 vaksin covid dari sinovac bakal bikin si penerima vaksin makin parah sak… https://t.co/gncp0saqnw
