id,tweet
[1330660248906940418],ylki minta pemerintah menanggung seluruh biaya vaksinasi covid-19 bagi warga https://t.co/v4rygjipeo
[1330658707500277760],"salip as, inggris bakal ijinkan penggunaan vaksin covid-19 pfizer pekan depan https://t.co/yu9klaxnil"
[1330658600016957441],menkeu sri mulyani menyampaikan akses terhadap vaksin covid-19 sangat penting. tidak akan ada pemulihan ekonomi di… https://t.co/uotikci3ly
[1330657822321721345],kanselir jerman khawatir covax belum negosiasi dengan produsen vaksin covid 19 https://t.co/v9lgcuikbb
[1330654177131806722],vaksin pfizer covid 19 potensi dapat persetujuan inggris pekan ini https://t.co/holxzkypxk https://t.co/b9q2tjvzkd
[1330653596946456584],penyaluran vaksin virus corona dinilai rentan bocor ke pasar gelap alias black market. https://t.co/xykp8g5w0l
[1330653588910051328],#selamatpagijogja l kompas l ktt g-20. deklarasi riyadh jamin akses setara pada vaksin covid-19#radio #sonorafmjogja
[1330651481339523072],"#bhdunia as anggar 30 juta penduduk akan diberi vaksin setiap bulan mulai januari 2021

https://t.co/jchon76da8"
[1330647037730177026],"sobat ibs... 

dki jakarta akan memberlakukan denda bagi warganya yang menolak divaksin covid-19 dengan sanksi pali… https://t.co/1pf4onloub"
[1330645426182127619],cina tawarkan kerjasama pengembangan vaksin covid-19 - https://t.co/obceiaraf4 https://t.co/3k9czxjrlw
[1330640308757938176],update perkembangan tahapan uji coba vaksin https://t.co/gsz4kmqfw5
[1330636402606927874],deklarasi #g20: komitmen untuk menangani kebutuhan pembiayaan vaksin corona https://t.co/keck3sayan
[1330626823156158464],"berita gembira kemanusiaan.

as mulai vaksinasi covid-19 di pertengahan desember ini.

diyakini awal tahun 2021 pan… https://t.co/az3ozfkw2m"
[1330626567458881536],bagaimana caranya mendorong masyarakat indo-pasifik agar bersedia menerima vaksin covid-19? dengarkan podcast perda… https://t.co/clwlrxs6gg
[1330608983258914820],"putera mahkota saudi: kita mesti membuat syarat untuk mendapatkan vaksin untuk coronavirus.
#alekhbaria. berita uta… https://t.co/pciaduxay9"
[1330600940831866880],seorang peneliti mencoba metode pemberian vaksin berupa tambalan microneedle. https://t.co/rfdmml5yl0
[1330588115107385345],"ternyata, vaksin covid-19 tidak memberikan kekebalan seumur hidup https://t.co/wc4ezbxquy"
[1330553807395201024],vaksin covid yang tablet ada gak ya?
[1330552816662847489],"@tsetiady krn orang sakit sendiri juga pasti membentuk antibodi covid scr natural.
tp bukan berarti vaksinnya ""jele… https://t.co/vwuzn6bvyc"
[1330552455126421505],"vaksin akan sesegera mungkin keceparan ketersediaannya guys.. 
tenang... pemerintah gak akan paikai cara2 yg haram.… https://t.co/wnlsijgxvl"
[1330552056428433408],"presiden @jokowi dorong akses vaksin covid-19 dibuka bagi semua negara
dunia saat ini tengah melihat dan menanti pe… https://t.co/jfk19d3jjc"
[1330551571214602242],"presiden @jokowi dorong akses vaksin covid-19 dibuka bagi semua negara
dunia saat ini tengah melihat dan menanti pe… https://t.co/nu1dq14ryq"
[1330538820903825411],"@vaksinuntukkita katanya jaga jarak, kok nyuruh pegangan tangan, ga mau ah bukan muhrim"
[1330538802650226699],"mengingat jumlah vaksinnya terbatas, maka pemerintah menerapkan kelompok prioritas yang bisa mendapatkannya. https://t.co/lpeof526af"
[1330537443062403073],"di ktt g20, presiden jokowi dorong akses vaksin covid-19 dibuka bagi semua negara

https://t.co/fmgkv54clo"
[1330535593135095808],"covid 19 ini nyata loh. rangkul anak-anak kalian, jangan mengorbankan anak-anak masuk sekolah saat vaksin belum ada… https://t.co/kauivzixo5"
[1330534928103002112],dunia kesehatan sambut positif kehadiran vaksin covid-19 https://t.co/8fqo51v9dr
[1330534847190798339],"@aik_arif ya allah...begini kok masyarakat masih debat mau masukin anaknya ke sekolah. tunggulah ada vaksin, tunggu… https://t.co/icaw1utkvp"
[1330534842518278144],dunia kesehatan sambut positif kehadiran vaksin covid-19 https://t.co/km3oophbh9
[1330528081589768198],"https://t.co/6aeqazarz7

masyarakat berangsur-angsur memahami akan pentingnya mendapatkan vaksin untuk mencegah ter… https://t.co/rgmjol8ve6"
[1330526270023634944],bayangin vaksin covid-19 dibuat di wakanda dengan campuran vibranium
[1330525500238807042],presiden @jokowi mendorong negara-negara g20 untuk memberikan perhatian bagi akses terhadap vaksin covid-19 yang ha… https://t.co/whil6gns6o
[1330523707555475463],@vaksinuntukkita pegangan tangan tapi suruh jaga jarak gimana ya sakit bgt min
[1330523641419804678],kalau lah jumpa vaksin yang dapat pulihkan covid-19... https://t.co/wbzclhotem
[1330523357192785920],survei menunjukkan mayoritas masyarakat indonesia telah mendengar tentang vaksin covid-19 dan bersedia menerimanya.… https://t.co/nczhoyhaz1
[1330523338804842497],til helang dah ada vaksin.... ataupun helang kalis covid-19
[1330522934562078721],"disebut dalang pandemi, bill gates: saya yakin vaksin covid-19 sangat aman https://t.co/ahvs1raxlc"
[1330522819185106945],vaksin covid-19 akan masuk indonesia bulan november atau desember tahun ini. optimis kita pasti bisa selesaikan vak… https://t.co/5kya0yizl0
[1330519971290517506],"selain ps5, mungkin dia da beli vaksin awal2. kalau kerabat j tumbang sbb covid, ini boleh jadi bukti.

🙄 https://t.co/7m9moutnww"
[1330518557717716993],presiden jokowi dorong akses vaksin covid-19 dibuka bagi semua negara https://t.co/rcdkbxrl9k https://t.co/q9iqvsecd8
[1330517824515633152],"sobat, sama-sama kita berharap ya kalau vaksin emang beneran bisa membantu mencegah penyebaran covid 19 deh.… https://t.co/hw4hp9hk4s"
[1330515769138966529],"saya mendukung langkah pemerintah untuk segera menyediakan vaksin agar rakyat indonesia terbebas dari covid, terima… https://t.co/mfgosuebem"
[1330515604336467969],"mudah2an segala prosedur kelayakan vaksin covid bisa segera beres, jadi vaksin siap untuk diberikan unk masyarakat.… https://t.co/a8noqxqa3m"
[1330515147870257153],"presiden jokowi dorong akses vaksin covid-19 dibuka bagi semua negara

dunia saat ini tengah melihat dan menanti pe… https://t.co/ntgmpsdfoy"
[1330515072393863168],indonesia akan menggunakan vaksin sinovac dan covax. vaksin sinovac ditargetkan digunakan pada desember untuk progr… https://t.co/o8ew68jg0z
[1330514919066890249],"dalam covax, dosis akan dialokasikan agar negara anggotanya dapat memvaksin tenaga kesehatan dan sosial, lalu manul… https://t.co/rfk7d9b2lw"
[1330513498867200002],vaksinolog sebut infrastruktur dan sdm indonesia memadai untuk distribusi vaksin covid-19 https://t.co/ltpnf4pu0a https://t.co/9tnzhzhvcq
[1330512450849042445],perusahaan pfizer ajukan proposal penggunaan vaksin darurat covid-19 ke badan pengawas obat dan makanan (fda) ameri… https://t.co/etxkygtl8t
[1330510852265553922],"sobat, sama-sama kita berharap ya kalau vaksin emang beneran bisa membantu mencegah penyebaran covid 19 deh. jangan… https://t.co/c2ohna6br3"
[1330507570080075778],"negara lain: sejauh mana efektivitas vaksin covid-19 yang sudah melewati uji fase 3?

indon, as always: https://t.co/bdhvy5xrvf"
[1330505052964974593],"@infoplk kunci pengendalian pandemi dgn 3t
bukan yg lain, apalagi cuma nunggu #vaksinasiprematur
.
dana penanganan… https://t.co/bqcm6ftsjc"
[1330504959545077761],"kita berharap kalau vaksin beneran bisa bantu cegah penyebaran covid-19. tonton yuk obrolan erick thohir, prof. ami… https://t.co/7s3vuncv8t"
[1330502674354229251],negara g20 berkomitmen mendanai distribusi vaksin covid-19 #g20 #vaksincovid19 #vaksin #asean #covid19… https://t.co/oiibnvwyyx
[1330502244836380678],"indonesia town hall - menanti vaksin covid-19 @jokowi

video fullnya di sini https://t.co/iq4cnphgrc"
[1330502049616723968],"klaim 94,5 persen ampuh, vaksin covid-19 moderna bakal dibanderol rp354.000-rp524.000 per dosis https://t.co/p7rlv14byx"
[1330500121360887808],@detikcom sebaiknya sih vaksinasi rabies aja disana. si ib gejalanya rabies bukan covid-19 deh.
[1330500074229489664],"kepala negara menegaskan, akses terhadap vaksin covid-19 harus dapat tersedia bagi semua negara tanpa terkecuali. k… https://t.co/tdkhski1ee"
[1330499935071039488],"""pertama, pendanaan bagi pemulihan kesehatan. dunia tidak akan sehat kecuali semua negara sudah sehat. vaksin adala… https://t.co/oy1jgxciov"
[1330499910118961152],pemerintah diminta tak bebankan biaya vaksin covid-19 ke rakyat https://t.co/vq8fxpmluq https://t.co/9lmxhapsz5
[1330499634981203969],alhamdulillah. vaksin covid-19 nampaknya dah sampai ke sini. berkesan nampaknya!! https://t.co/v7cx5uxp3y
[1330497394652315649],dunia kesehatan sambut positif kehadiran vaksin covid-19 https://t.co/q2j3i5fmtz https://t.co/pcfhhhttur
[1330497144772386816],"klaim 94,5 persen ampuh, vaksin covid-19 moderna bakal dibanderol rp354 ribu - rp524 ribu per dosis https://t.co/mo3xnlmiur"
[1330496982201163776],"@petamburan_iii semprot lah sesuka hati kalian!!!! cuci tangan,masker itu biasa ,kl vaksin pikir pikir lah"
[1330492296350085125],andai kata vaksin covid-19 terbukti berkesan. antivac nak ambil tak?
